{"assistance_policy":{"ai_declaration":true,"hints":true,"references":true,"solution":true},"capability_refs":[{"id":"M1-01","version":2}],"content_ref":"web/src/content/learning/toolchain-feedback.mdx","evidence_rules":[{"capability_id":"M1-01","capability_version":2,"evidence_type":"implement","result":"passed","rule_id":"toolchain-baseline-builds"}],"id":"guided-run-model","kind":"learning_task","mode":"guided","task_ref":{"id":"guided-run-model-v2","version":6},"title":"读懂 Go 工具链反馈","version":6}