{"assistance_policy":{"ai_declaration":true,"hints":true,"references":true,"solution":false},"capability_refs":[{"id":"M1-07","version":1}],"evidence_rules":[{"capability_id":"M1-07","capability_version":1,"evidence_type":"implement","result":"passed","rule_id":"invalid-input-rejected"},{"capability_id":"M1-07","capability_version":1,"evidence_type":"implement","result":"passed","rule_id":"stable-output"}],"id":"practice-json-io","kind":"learning_task","mode":"practice","task_ref":{"id":"practice-json-io-v1","version":2},"title":"补全 JSON 读取与稳定输出","version":2}