{"assistance_policy":{"ai_declaration":true,"hints":true,"references":true,"solution":false},"capability_refs":[{"id":"M1-13","version":1}],"content_ref":"web/src/content/learning/cancellable-map-practice-v1.mdx","evidence_rules":[{"capability_id":"M1-13","capability_version":1,"evidence_type":"implement","result":"passed","rule_id":"cancellation-practiced"}],"id":"practice-cancellable-map","kind":"learning_task","mode":"practice","task_ref":{"id":"practice-cancellable-map-v1","version":1},"title":"为并发映射接入取消","version":1}