{"assistance_policy":{"ai_declaration":true,"hints":true,"references":true,"solution":true},"capability_refs":[{"id":"M2-14","version":1}],"content_ref":"web/src/content/learning/release-gates-practice-v1.mdx","evidence_rules":[{"capability_id":"M2-14","capability_version":1,"evidence_type":"test","result":"passed","rule_id":"release-plan-validates"}],"id":"practice-release-gates","kind":"learning_task","mode":"practice","task_ref":{"id":"practice-release-gates-v1","version":1},"title":"把发布要求变成可执行门禁","version":1}