{"assistance_policy":{"ai_declaration":true,"hints":true,"references":true,"solution":true},"capability_refs":[{"id":"M2-15","version":1}],"content_ref":"web/src/content/learning/miniflux-call-chain-practice-v1.mdx","evidence_rules":[{"capability_id":"M2-15","capability_version":1,"evidence_type":"implement","result":"passed","rule_id":"miniflux-call-chains-traced"}],"id":"practice-miniflux-call-chain","kind":"learning_task","mode":"practice","task_ref":{"id":"practice-miniflux-call-chain-v1","version":1},"title":"在固定 Miniflux 源码中建立两条调用链","version":1}