{"assistance_policy":{"ai_declaration":true,"hints":true,"references":true,"solution":true},"capability_refs":[{"id":"M1-01","version":1}],"content_ref":"web/src/content/go-basics/ch10-packages-tools.mdx","evidence_rules":[{"capability_id":"M1-01","capability_version":1,"evidence_type":"diagnose","result":"passed","rule_id":"tool-feedback-explained"}],"id":"guided-run-model","kind":"learning_task","mode":"guided","task_ref":{"id":"guided-run-model-v1","version":1},"title":"读懂 Go 工具链反馈","version":1}