{
  "id": "guided-run-model",
  "version": 4,
  "title": "读懂 Go 工具链反馈",
  "kind": "learning_task",
  "mode": "guided",
  "capability_refs": [{"id": "M1-01", "version": 2}],
  "task_ref": {"id": "guided-run-model-v2", "version": 4},
  "content_ref": "web/src/content/learning/toolchain-feedback.mdx",
  "assistance_policy": {"hints": true, "references": true, "solution": true, "ai_declaration": true},
  "evidence_rules": [
    {"rule_id": "toolchain-baseline-builds", "capability_id": "M1-01", "capability_version": 2, "evidence_type": "implement", "result": "passed"},
    {"rule_id": "toolchain-reflection-recorded", "capability_id": "M1-01", "capability_version": 2, "evidence_type": "diagnose", "result": "passed"}
  ]
}
