{"assistance_policy":{"ai_declaration":true,"hints":true,"references":true,"solution":false},"capability_refs":[{"id":"M1-10","version":1}],"content_ref":"web/src/content/learning/metrics-debug-review-v1.mdx","evidence_rules":[{"capability_id":"M1-10","capability_version":1,"evidence_type":"implement","result":"passed","rule_id":"regression-fixed"},{"capability_id":"M1-10","capability_version":1,"evidence_type":"diagnose","result":"passed","rule_id":"static-analysis-clean"},{"capability_id":"M1-10","capability_version":1,"evidence_type":"diagnose","result":"passed","rule_id":"profile-diagnosis-explained"}],"id":"review-metrics-debug","kind":"learning_task","mode":"review","task_ref":{"id":"review-metrics-debug-v1","version":1},"title":"变式复习指标生成诊断","version":1}