{"assistance_policy":{"ai_declaration":true,"hints":true,"references":true,"solution":false},"capability_refs":[{"id":"M1-11","version":1}],"content_ref":"web/src/content/learning/bounded-pipeline-practice-v1.mdx","evidence_rules":[{"capability_id":"M1-11","capability_version":1,"evidence_type":"implement","result":"passed","rule_id":"bounded-pipeline-practiced"}],"id":"practice-bounded-pipeline","kind":"learning_task","mode":"practice","task_ref":{"id":"practice-bounded-pipeline-v1","version":1},"title":"构造受控并发映射","version":1}