{"assistance_policy":{"ai_declaration":true,"hints":true,"references":true,"solution":true},"capability_refs":[{"id":"M1-02","version":1}],"content_ref":"web/src/content/learning/core-semantics-guided-v1.mdx","evidence_rules":[{"capability_id":"M1-02","capability_version":1,"evidence_type":"implement","result":"passed","rule_id":"core-semantics-practiced"}],"id":"guided-core-semantics","kind":"learning_task","mode":"guided","task_ref":{"id":"guided-core-semantics-v1","version":1},"title":"用 Go 语义整理名称","version":1}