{"assistance_policy":{"ai_declaration":true,"hints":true,"references":true,"solution":false},"capability_refs":[{"id":"M1-12","version":1}],"content_ref":"web/src/content/learning/protected-counter-practice-v1.mdx","evidence_rules":[{"capability_id":"M1-12","capability_version":1,"evidence_type":"implement","result":"passed","rule_id":"shared-state-practiced"}],"id":"practice-protected-counter","kind":"learning_task","mode":"practice","task_ref":{"id":"practice-protected-counter-v1","version":1},"title":"修复共享计数器","version":1}