{
  "id": "assessment-check-config",
  "version": 4,
  "title": "实现配置规范化命令",
  "kind": "learning_task",
  "mode": "assessment",
  "capability_refs": [{"id": "M1-01", "version": 2}, {"id": "M1-03", "version": 1}, {"id": "M1-07", "version": 1}, {"id": "M1-09", "version": 1}],
  "task_ref": {"id": "assessment-check-config-v2", "version": 3},
  "content_ref": "web/src/content/learning/config-normalizer-assessment-v1.mdx",
  "assistance_policy": {"hints": true, "references": true, "solution": false, "ai_declaration": true},
  "evidence_rules": [
    {"rule_id": "module-builds", "capability_id": "M1-01", "capability_version": 2, "evidence_type": "implement", "result": "passed"},
    {"rule_id": "toolchain-checks-pass", "capability_id": "M1-01", "capability_version": 2, "evidence_type": "diagnose", "result": "passed"},
    {"rule_id": "error-chain-preserved", "capability_id": "M1-03", "capability_version": 1, "evidence_type": "implement", "result": "passed"},
    {"rule_id": "resource-closed", "capability_id": "M1-03", "capability_version": 1, "evidence_type": "implement", "result": "passed"},
    {"rule_id": "invalid-input-rejected", "capability_id": "M1-07", "capability_version": 1, "evidence_type": "implement", "result": "passed"},
    {"rule_id": "stable-output", "capability_id": "M1-07", "capability_version": 1, "evidence_type": "implement", "result": "passed"},
    {"rule_id": "cli-failure-contract", "capability_id": "M1-07", "capability_version": 1, "evidence_type": "implement", "result": "passed"},
    {"rule_id": "learner-tests-present", "capability_id": "M1-09", "capability_version": 1, "evidence_type": "test", "result": "passed"},
    {"rule_id": "visible-tests-pass", "capability_id": "M1-09", "capability_version": 1, "evidence_type": "test", "result": "passed"},
    {"rule_id": "held-out-tests-pass", "capability_id": "M1-09", "capability_version": 1, "evidence_type": "test", "result": "passed"}
  ]
}
