{"assistance_policy":{"ai_declaration":true,"hints":false,"references":false,"solution":false},"capability_refs":[{"id":"M1-02","version":1}],"content_ref":"web/src/content/learning/temperature-bands-review-v1.mdx","evidence_rules":[{"capability_id":"M1-02","capability_version":1,"evidence_type":"implement","result":"passed","rule_id":"unicode-control-flow-correct"},{"capability_id":"M1-02","capability_version":1,"evidence_type":"implement","result":"passed","rule_id":"named-type-zero-defaults"}],"id":"review-temperature-bands","kind":"learning_task","mode":"review","task_ref":{"id":"review-temperature-bands-v1","version":1},"title":"温度区间语义复验","version":1}