{
  "id": "practice-package-contract",
  "version": 1,
  "title": "拆出可复用的报告包",
  "kind": "learning_task",
  "mode": "practice",
  "capability_refs": [{"id": "M1-08", "version": 1}],
  "task_ref": {"id": "practice-package-contract-v1", "version": 1},
  "content_ref": "web/src/content/learning/package-contract-practice-v1.mdx",
  "assistance_policy": {"hints": true, "references": true, "solution": false, "ai_declaration": true},
  "evidence_rules": [
    {"rule_id": "package-contract-practiced", "capability_id": "M1-08", "capability_version": 1, "evidence_type": "implement", "result": "passed"}
  ]
}
