{"assistance_policy":{"ai_declaration":true,"hints":false,"references":false,"solution":false},"capability_refs":[{"id":"M1-03","version":1},{"id":"M1-07","version":1},{"id":"M1-09","version":1}],"content_ref":"web/src/content/learning/config-merge-review-v1.mdx","evidence_rules":[{"capability_id":"M1-03","capability_version":1,"evidence_type":"implement","result":"passed","rule_id":"error-chain-preserved"},{"capability_id":"M1-07","capability_version":1,"evidence_type":"implement","result":"passed","rule_id":"invalid-input-rejected"},{"capability_id":"M1-07","capability_version":1,"evidence_type":"implement","result":"passed","rule_id":"stable-output"},{"capability_id":"M1-09","capability_version":1,"evidence_type":"test","result":"passed","rule_id":"learner-tests-present"},{"capability_id":"M1-09","capability_version":1,"evidence_type":"test","result":"passed","rule_id":"held-out-tests-pass"}],"id":"review-check-config-variant","kind":"learning_task","mode":"review","task_ref":{"id":"review-check-config-variant-v2","version":3},"title":"配置合并器变式复验","version":4}