{"assistance_policy":{"ai_declaration":true,"hints":true,"references":true,"solution":false},"capability_refs":[{"id":"M1-09","version":1}],"content_ref":"web/src/content/learning/table-tests-practice-v1.mdx","evidence_rules":[{"capability_id":"M1-09","capability_version":1,"evidence_type":"test","result":"passed","rule_id":"learner-tests-present"},{"capability_id":"M1-09","capability_version":1,"evidence_type":"test","result":"passed","rule_id":"visible-tests-pass"}],"id":"practice-table-tests","kind":"learning_task","mode":"practice","task_ref":{"id":"practice-table-tests-v1","version":2},"title":"扩展表格驱动测试","version":3}